{
  "$schema": "https://json-schema.org/draft/2020-12/schema",
  "$id": "https://tts-research.local/schemas/repair-overlay.v1.schema.json",
  "title": "RepairOverlay v1",
  "type": "object",
  "additionalProperties": false,
  "required": [
    "schemaVersion",
    "overlayId",
    "sourceId",
    "sourceRevisionId",
    "targetRevisionId",
    "createdAt",
    "immutable",
    "changes",
    "summary"
  ],
  "properties": {
    "schemaVersion": {
      "const": "repair-overlay.v1"
    },
    "overlayId": {
      "type": "string",
      "minLength": 1
    },
    "sourceId": {
      "type": "string",
      "minLength": 1
    },
    "sourceRevisionId": {
      "type": "string",
      "minLength": 1
    },
    "targetRevisionId": {
      "type": "string",
      "minLength": 1
    },
    "createdAt": {
      "type": "string",
      "format": "date-time"
    },
    "createdBy": {
      "type": "string"
    },
    "immutable": {
      "const": true
    },
    "changes": {
      "type": "array",
      "minItems": 1,
      "items": {
        "type": "object",
        "additionalProperties": false,
        "required": ["changeId", "op", "unitId", "reason"],
        "properties": {
          "changeId": {
            "type": "string",
            "minLength": 1
          },
          "op": {
            "enum": ["replace_text", "insert_text", "delete_text", "mark_blocked", "metadata_patch"]
          },
          "unitId": {
            "type": "string",
            "minLength": 1
          },
          "locator": {
            "$ref": "content-ir.v1.schema.json#/$defs/locator"
          },
          "beforeText": {
            "type": "string"
          },
          "afterText": {
            "type": "string"
          },
          "reason": {
            "type": "string"
          }
        }
      }
    },
    "summary": {
      "type": "string"
    },
    "metadata": {
      "type": "object",
      "additionalProperties": true
    }
  }
}
